{
  "$schema": "http://json-schema.org/draft-07/schema#",
  "$comment": "GENERATED by gui/schema-gen/derive_nf_config_schemas.py from config/smf.json + its source (ADR-0425). Do not edit; regenerate.",
  "title": "smf",
  "type": "object",
  "additionalProperties": false,
  "properties": {
    "port": {
      "type": "integer",
      "x-cpp-type": "unsigned short"
    },
    "upf_pfcp_port": {
      "type": "integer",
      "x-env-override": "SMF_UPF_PFCP_PORT",
      "x-cpp-type": "std::uint16_t"
    },
    "sbi_bind_address": {
      "type": "string",
      "x-cpp-type": "std::string"
    },
    "metrics_bind_address": {
      "type": "string",
      "x-cpp-type": "std::string"
    },
    "nrf_base_url": {
      "type": "string",
      "x-env-override": "SMF_NRF_BASE_URL",
      "x-cpp-type": "std::string"
    },
    "self_base_url": {
      "type": "string",
      "x-env-override": "SMF_SELF_BASE_URL",
      "x-cpp-type": "std::string"
    },
    "pcf_base_url": {
      "type": "string",
      "x-env-override": "SMF_PCF_BASE_URL",
      "x-cpp-type": "std::string"
    },
    "nsacf_base_url": {
      "type": "string",
      "x-env-override": "SMF_NSACF_BASE_URL",
      "x-cpp-type": "std::string"
    },
    "amf_base_url": {
      "type": "string",
      "x-env-override": "SMF_AMF_BASE_URL",
      "x-cpp-type": "std::string"
    },
    "chf_base_url": {
      "type": "string",
      "x-env-override": "SMF_CHF_BASE_URL",
      "x-cpp-type": "std::string"
    },
    "udr_base_url": {
      "type": "string",
      "x-env-override": "SMF_UDR_BASE_URL",
      "x-cpp-type": "std::string"
    },
    "qos_mon_interval_seconds": {
      "type": "integer",
      "x-env-override": "SMF_QOS_MON_INTERVAL_SECONDS",
      "x-cpp-type": "int"
    },
    "li_poi": {
      "type": "object",
      "additionalProperties": false,
      "properties": {
        "enabled": {
          "type": "boolean"
        },
        "x1_bind_address": {
          "type": "string"
        },
        "x1_port": {
          "type": "integer"
        },
        "ne_identifier": {
          "type": "string"
        },
        "network_function_id": {
          "type": "string"
        },
        "interception_point_id": {
          "type": "string"
        },
        "mdf2_host": {
          "type": "string"
        },
        "mdf2_port": {
          "type": "integer"
        },
        "mdf2_sni": {
          "type": "string"
        },
        "x1_keepalive_p1_seconds": {
          "type": "integer"
        },
        "x1_keepalive_p2_seconds": {
          "type": "integer"
        },
        "x1_keepalive_p3_seconds": {
          "type": "integer"
        },
        "x1_allow_deactivate_all": {
          "type": "boolean"
        },
        "cc_tf": {
          "type": "object",
          "additionalProperties": false,
          "properties": {
            "enabled": {
              "type": "boolean"
            },
            "tf_identifier": {
              "type": "string"
            },
            "upf_ne_identifier": {
              "type": "string"
            },
            "upf_x1_url": {
              "type": "string"
            }
          }
        }
      }
    },
    "oauth2_required": {
      "type": "boolean",
      "x-env-override": "SMF_OAUTH2_REQUIRED",
      "x-cpp-type": "bool"
    }
  },
  "required": [
    "amf_base_url",
    "chf_base_url",
    "metrics_bind_address",
    "nrf_base_url",
    "nsacf_base_url",
    "pcf_base_url",
    "port",
    "sbi_bind_address",
    "self_base_url",
    "udr_base_url",
    "upf_pfcp_port"
  ],
  "x-config-file": "config/smf.json",
  "x-source": [
    "nfs/smf"
  ],
  "x-apply": "restart",
  "x-review": [
    "li_poi: nested object shape inferred from current values (map-vs-struct meaning unverified; new keys refused until reviewed)",
    "li_poi.cc_tf: nested object shape inferred from current values (map-vs-struct meaning unverified; new keys refused until reviewed)"
  ]
}
